start,dur,text
5679.77,15.06,this lecture and I will see you in the
5682.56,16.65,next lecture we will now look at docker
5694.83,7.32,registry so what is a registry if the
5699.21,5.37,containers were the rain then they would
5702.15,3.45,rain from the docker registry which are
5704.58,3.539,the clouds
5705.6,6,that's where docker images are stored
5708.119,6.391,it's a central repository of all docker
5711.6,6.119,images let's look at a simple nginx
5714.51,6.149,container we run the docker run engine X
5717.719,5.551,command to run an instance of the nginx
5720.659,6.841,image let's take a closer look at that
5723.27,6.24,image name now the name is nginx but
5727.5,4.98,what is this image and where is this
5729.51,6.3,image pulled from this name follows
5732.48,6.63,Dockers image naming convention nginx
5735.81,5.54,here is the image or the repository name
5739.11,6.23,when you say nginx
5741.35,6.87,it's actually nginx / nginx the first
5745.34,5.79,part stands for the user or account name
5748.22,5.37,so if you don't provide an account or a
5751.13,4.59,repository name it assumes that it is
5753.59,5.7,the same as the given name which in this
5755.72,6.24,case is nginx the user names is usually
5759.29,4.62,your docker hub account name or if it is
5761.96,4.65,an organization then it's the name of
5763.91,5.04,the organization if you were to create
5766.61,5.49,your own account and create your own
5768.95,6.3,repositories or images under it then you
5772.1,5.75,would use a similar pattern now where
5775.25,5.49,are these images stored and pulled from
5777.85,4.72,since we have not specified the location
5780.74,5.13,where these images are to be pulled from
5782.57,6.69,it is assumed to be on Dockers default
5785.87,7.02,registry docker hub the dns name for
5789.26,6,which is dr. al the registry is where
5792.89,4.56,all the images are stored whenever you
5795.26,4.95,create a new image or update an existing
5797.45,4.68,image you push it to the registry and
5800.21,4.26,every time anyone deploys this
5802.13,4.8,application it is pulled from that
5804.47,4.83,registry there are many other popular
5806.93,4.92,registries as well for example Google's
5809.3,4.65,registry is that VCR that i/o where a
5811.85,4.38,lot of kubernetes related images are
5813.95,4.8,stored like the ones used for performing
5816.23,5.25,end-to-end tests on the cluster these
5818.75,6.33,are all publicly accessible images that
5821.48,5.76,anyone can download and access when you
5825.08,3.75,have applications built in-house that
5827.24,2.01,shouldn't be made available to the
5828.83,3.39,public
5829.25,5.49,hosting an internal private registry may
5832.22,4.77,be a good solution many cloud service
5834.74,5.52,providers such as Arab leaders as your
5836.99,5.37,GCP provide a private registry by
5840.26,5.25,default when you open an account with
5842.36,5.91,them on any of these solutions be a
5845.51,5.01,docker hub or Google registry or your
5848.27,4.98,internal private registry you may choose
5850.52,4.98,to make a repository private so that it
5853.25,5.58,can only be accessed using a set of
5855.5,5.64,credentials from Dockers perspective to
5858.83,5.01,run a container using an image from a
5861.14,5.04,private registry you first log into your
5863.84,5.1,private registry using the docker login
5866.18,4.8,command input your credentials once
5868.94,4.26,successful run the application using
5870.98,3.749,private registry as part of the image
5873.2,3.749,name like this
5874.729,4.381,now if you did not log into the private
5876.949,5.221,registry it will come back saying that
5879.11,5.429,the image cannot be found so remember to
5882.17,6.059,always log in before pulling or pushing
5884.539,7.051,to a private registry we said that cloud
5888.229,5.071,providers like AWS or GCP provide a
5891.59,3.69,private registry when you create an
5893.3,4.199,account with them but what if you are
5895.28,4.709,running your application on-premise and
5897.499,4.98,don't have a private registry how do you
5899.989,5.67,deploy your own private registry within
5902.479,5.76,your organization the docker registry is
5905.659,5.34,itself another application and of course
5908.239,5.82,is available as a docker image the name
5910.999,6.81,of the image is registry and it exposes
5914.059,6.27,"the API on port 5,000 now that you have"
5917.809,5.64,your custom registry running at port
5920.329,7.17,"5,000 on this docker host how do you"
5923.449,7.23,push your own image to it use the docker
5927.499,5.73,image tag command to tag the image with
5930.679,4.8,a private registry URL in it in this
5933.229,5.421,case since it's running on the same door
5935.479,7.321,host I can use localhost semi colon
5938.65,6.339,"5,000 followed by the image name I can"
5942.8,4.469,then push my image to my local private
5944.989,4.411,registry using the command docker push
5947.269,4.801,and the new image name with the docker
5949.4,5.04,registry information in it from there on
5952.07,4.77,I can pull my image from anywhere within
5954.44,5.19,this network using either localhost if
5956.84,5.369,you're on the same host or the IP or
5959.63,4.829,domain name of my docker host if I'm
5962.209,5.01,accessing from another host in my
5964.459,3.301,environment well that's it for this
5967.219,2.13,lecture
5967.76,4.799,hello words of the practice test and
5969.349,4.181,practice working with private docker
5972.559,9.811,registries
5973.53,11.73,[Music]
5982.37,4.81,welcome to this lecture on docker engine
5985.26,5.25,in this lecture we will take a deeper
5987.18,5.7,look at Dockers architecture how it
5990.51,4.53,actually runs applications in isolated
5992.88,6.33,containers and how it works under the
5995.04,6.96,hoods docker engine as we have learned
5999.21,5.19,before is simply referred to a host with
6002,5.04,docker installed on it when you install
6004.4,4.67,docker on a Linux host you're actually
6007.04,5.64,installing three different components
6009.07,6.91,the docker demon the rest API server and
6012.68,5.7,the docker CLI the docker daemon is a
6015.98,5.16,background process that manages docker
6018.38,5.79,objects such as the images containers
6021.14,5.79,volumes and networks the docker REST API
6024.17,5.01,server is the API interface that
6026.93,4.5,programs can use to talk to the daemon
6029.18,4.44,and provide instructions you could
6031.43,5.31,create your own tools using this REST
6033.62,5.28,API and the docker CLI is nothing but
6036.74,4.89,the command-line interface that we've
6038.9,4.86,been using until now to perform actions
6041.63,6.06,such as running a container stopping
6043.76,6.57,containers destroying images etc it uses
6047.69,6.48,the REST API to interact with the docker
6050.33,6.9,demon something to note here is that the
6054.17,5.64,docker CLI need not necessarily be on
6057.23,5.94,the same host it could be on another
6059.81,6.93,system like a laptop and can still work
6063.17,6.36,with a remote docker engine simply use
6066.74,6.15,the dash 8 option on the docker command
6069.53,6.36,and specify the remote docker engine
6072.89,6.42,address and a port as shown here for
6075.89,6.33,example to run a container based on ng
6079.31,7.71,INX on a remote docker host run the
6082.22,16.08,command docker dash H equals 10.1 23
6087.02,11.9,2000 call n' to 375 run and the Ln X now
6098.3,3.2,let's try
6098.92,5.67,understand how exactly our applications
6101.5,4.05,containerized in docker how does it work
6104.59,4.05,under the hood
6105.55,6.3,docker uses namespaces to isolate
6108.64,6.3,workspace process IDs network
6111.85,6.21,inter-process communication mounds and
6114.94,5.759,unix time sharing systems are created in
6118.06,8.13,their own namespace thereby providing
6120.699,7.741,isolation between containers let's take
6126.19,5.73,a look at one of the namespace isolation
6128.44,6.09,technique process ID namespaces whenever
6131.92,4.98,a Linux system boots up it starts with
6134.53,5.16,just one process with a process ID of
6136.9,4.89,one this is the root process and kicks
6139.69,4.77,off all the other processes in the
6141.79,4.83,system by the time the system boots up
6144.46,5.219,completely we have a handful of
6146.62,5.76,processors running this can be seen by
6149.679,6,running the PS command to list all the
6152.38,6.45,running processes the process IDs are
6155.679,6.691,unique and two processes cannot have the
6158.83,6.03,same process ID now if we were to create
6162.37,4.55,a container which is basically like a
6164.86,5.58,child system within the current system
6166.92,5.77,the child system needs to think that it
6170.44,4.82,is an independent system on its own and
6172.69,5.37,it has its own set of processes
6175.26,6.939,originating from a root process with a
6178.06,6.179,process ID of one but we note that there
6182.199,4.381,is no hard isolation between the
6184.239,3.96,containers and the underlying host so
6186.58,4.17,the processes running inside the
6188.199,4.621,container or in fact processes running
6190.75,4.44,on the underlying host and so two
6192.82,5.76,processes cannot have the same process
6195.19,6.09,ID of one this is where namespaces come
6198.58,4.92,into play with process ID namespaces
6201.28,5.13,each process can have multiple process
6203.5,4.65,IDs associated with it for example when
6206.41,3.66,the processes start in the container
6208.15,4.23,it's actually just another set of
6210.07,4.98,processes on the base Linux system and
6212.38,6.33,it gets the next available process ID in
6215.05,6.39,this case 5 & 6 however they also get
6218.71,4.95,another process ID starting with PID 1
6221.44,5.07,in the container name space which is
6223.66,4.95,only visible inside the container so the
6226.51,4.77,container thinks that it has its own
6228.61,3.489,root process tree and so it is an
6231.28,3.699,independent
6232.099,5.491,system so how does that relate to an
6234.979,5.94,actual system how do you see this on a
6237.59,5.969,host let's say I were to run an ng I
6240.919,4.05,next server as a container we know that
6243.559,4.71,the ng r NX container
6244.969,5.55,runs an ng Aria next service if we were
6248.269,4.83,to list all the services inside the
6250.519,5.011,docker container we see that the ng
6253.099,5.73,ionic service running with a process ID
6255.53,5.129,of one this is the process ID of the
6258.829,5.19,service inside of the container
6260.659,6.09,namespace if we list the services on the
6264.019,6.18,docker host we will see the same service
6266.749,6.45,but with a different process ID that
6270.199,5.82,indicates that all processes are in fact
6273.199,5.331,running on the same host but separated
6276.019,7.08,into their own containers using
6278.53,6.759,namespaces so we learned that the
6283.099,4.53,underlying docker host as well as the
6285.289,6.27,containers share the same system
6287.629,6.09,resources such as CPU and memory how
6291.559,4.471,much of the resources are dedicated to
6293.719,4.68,the host and the containers and how does
6296.03,5.969,docker manage and share the resources
6298.399,5.76,between the containers by default there
6301.999,5.281,is no restriction as to how much of a
6304.159,5.73,resource a container can use and hence a
6307.28,5.879,container may end up utilizing all of
6309.889,5.34,the resources on the underlying host but
6313.159,5.88,there is a way to restrict the amount of
6315.229,6.66,CPU or memory a container can use docker
6319.039,4.59,uses C groups or control groups to
6321.889,4.94,restrict the amount of hardware
6323.629,6.901,resources allocated to each container
6326.829,6.37,this can be done by providing the - -
6330.53,6.089,CPUs option to the docker run command
6333.199,5.851,providing a value of 0.5 will ensure
6336.619,5.911,that the container does not take up more
6339.05,6.839,than 50% of the host CPU at any given
6342.53,6.629,time the same goes with memory setting a
6345.889,5.431,value of 100 m to the - - memory option
6349.159,4.97,limits the amount of memory the
6351.32,5.969,container can use to a hundred megabytes
6354.129,5.921,if you are interested in reading more on
6357.289,5.79,this topic refer to the links I posted
6360.05,5.189,in the reference page that's it for now
6363.079,4.62,on docker engine in the
6365.239,4.741,lecture we talk about other advanced
6367.699,14.79,topics on docker storage and file
6369.98,14.61,systems see you in the next layer in
6382.489,4.411,this course we learned that containers
6384.59,4.319,share the underlying OS kernel and as a
6386.9,4.23,result we cannot have a windows
6388.909,4.951,container running on Linux host or
6391.13,4.92,vice-versa we need to keep this in mind
6393.86,3.929,while going through this lecture as it's
6396.05,4.23,very important concept and most
6397.789,5.011,beginners tend to have an issue with it
6400.28,5.669,so what are the options available for
6402.8,6.029,docker on Windows there are two options
6405.949,5.641,available the first one is darker on
6408.829,5.341,Windows using docker toolbox and the
6411.59,4.77,second one is the docker desktop for
6414.17,4.949,Windows option we will look at each of
6416.36,5.85,these now let's take a look at the first
6419.119,5.571,option docker toolbox this was the
6422.21,5.099,original support for docker on Windows
6424.69,5.139,imagine that you have a Windows laptop
6427.309,4.591,and no access to any Linux system
6429.829,4.951,whatsoever but you would like to try
6431.9,5.4,docker you don't have access to a Linux
6434.78,5.489,system in the lab or in the cloud what
6437.3,4.739,would you do what I did was to install a
6440.269,4.051,virtualization software on my Windows
6442.039,4.921,system like Oracle VirtualBox or we my
6444.32,6.029,workstation and deploy a Linux VM on it
6446.96,5.849,such as Ubuntu or Debian then install
6450.349,5.52,docker on the Linux VM and then play
6452.809,6,around with it this is what the first
6455.869,5.341,option really does it doesn't really
6458.809,4.44,have anything much to do with Windows
6461.21,4.619,you cannot create Windows based docker
6463.249,4.981,images or run Windows based docker
6465.829,4.321,containers you obviously cannot run
6468.23,4.739,Linux container directly on Windows
6470.15,5.67,either you're just working with docker
6472.969,5.911,on a Linux virtual machine on a Windows
6475.82,5.399,host docker however provides us with a
6478.88,5.4,set of tools to make this easy which is
6481.219,5.67,called as the docker toolbox the docker
6484.28,5.489,toolbox contains a set of tools like
6486.889,4.83,Oracle VirtualBox dr. engine docker
6489.769,4.741,machine docker compose and a user
6491.719,4.471,interface called kite Matic this will
6494.51,3.27,help you get started by simply
6496.19,2.81,downloading and running the docker
6497.78,4.16,toolbox executed
6499,5.43,I will install worship works deploy a
6501.94,4.86,lightweight VM called boot to docker
6504.43,4.41,which has darker running in it already
6506.8,4.14,so that you are all set to start with
6508.84,2.99,docker easily and with within a short
6510.94,3.81,period of time
6511.83,4.87,now what about requirements you must
6514.75,5.37,ensure that your operating system is
6516.7,5.46,64-bit Windows 7 or higher and that the
6520.12,5.31,virtualization is enabled on the system
6522.16,5.46,now remember docker to box is a legacy
6525.43,4.29,solution for all the Windows systems
6527.62,5.97,that do not meet requirements for the
6529.72,6.54,newer docker for Windows option the
6533.59,5.28,second option is the newer an option
6536.26,4.05,called docker desktop for Windows in the
6538.87,4.14,previous option we saw that we had
6540.31,5.16,Oracle VirtualBox installed on Windows
6543.01,5.58,and then a Linux system and then docker
6545.47,4.95,on that Linux system now with docker for
6548.59,3.54,Windows we take out Oracle VirtualBox
6550.42,3.84,and use the native virtualization
6552.13,4.59,technology available with Windows called
6554.26,4.05,Microsoft hyper-v during the
6556.72,3.48,installation process for docker for
6558.31,4.11,Windows it will still automatically
6560.2,4.32,create a Linux system underneath but
6562.42,4.92,this time it is created on the Microsoft
6564.52,4.55,hyper-v instead of Oracle VirtualBox and
6567.34,4.41,have docker running on that system
6569.07,4.63,because of this dependency on hyper-v
6571.75,4.2,this option is only supported for
6573.7,4.85,Windows 10 enterprise or professional
6575.95,4.5,Edition and on Windows Server 2016
6578.55,5.56,because both these operating systems
6580.45,6.39,come with hyper-v support by default now
6584.11,5.31,here is the most important point so far
6586.84,4.83,whatever we have been discussing with
6589.42,4.92,Dockers support for Windows it is
6591.67,5.22,strictly for Linux containers Linux
6594.34,4.92,applications packaged into Linux docker
6596.89,4.23,images we're not talking about Windows
6599.26,4.41,applications or Windows images or
6601.12,5.31,windows containers both the options we
6603.67,6.51,just discussed will help you run a Linux
6606.43,7.32,container on a Windows host with Windows
6610.18,5.28,Server 2016 Microsoft announced support
6613.75,4.35,for Windows containers for the first
6615.46,4.95,time you can now packaged applications
6618.1,4.59,Windows applications into Windows docker
6620.41,4.65,containers and run them on Windows
6622.69,5.37,docker host using docker desktop for
6625.06,5.97,Windows when you install docker desktop
6628.06,4.74,for Windows the default option is to
6631.03,3.75,work with Linux containers
6632.8,4.31,but if you would like to run Windows
6634.78,5.49,containers then you must explicitly
6637.11,7.03,configure docker for Windows to switch
6640.27,6.33,to using Windows containers in early
6644.14,5.19,2016 Microsoft announced Windows
6646.6,4.8,containers now you could create Windows
6649.33,3.66,based images and run Windows containers
6651.4,4.29,on a Windows server just like how you
6652.99,5.76,would run Linux containers on a Linux
6655.69,5.25,system now you can create Windows images
6658.75,4.76,container as your applications and share
6660.94,5.64,them through the docker store as well
6663.51,6.1,unlike in Linux there are two types of
6666.58,5.1,containers in Windows the first one is a
6669.61,4.35,Windows Server container which works
6671.68,4.56,exactly like Linux containers where the
6673.96,4.56,OS kernel is shared with the underlying
6676.24,4.47,operating system to allow better
6678.52,3.72,security boundary between containers and
6680.71,3.87,to a lot of kernels with different
6682.24,4.95,versions and configurations to coexist
6684.58,5.64,the second option was introduced known
6687.19,6.48,as the hyper-v isolation with hyper-v
6690.22,5.46,isolation each container is run within a
6693.67,4.5,highly optimized virtual machine
6695.68,3.9,guaranteeing complete kernel isolation
6698.17,4.14,between the containers and the
6699.58,5.22,underlying host now while in the Linux
6702.31,4.95,world you had a number of base images
6704.8,5.4,for a Linux system such as Ubuntu debian
6707.26,4.86,fedora Alpine etc if you remember that
6710.2,4.08,that is what you specify at the
6712.12,4.53,beginning of the docker file in the
6714.28,5.37,windows world we have two options the
6716.65,5.76,Windows server core and nano server a
6719.65,4.83,nano server is a headless deployment
6722.41,4.5,option for Windows Server which runs at
6724.48,4.62,a fraction of size of the full operating
6726.91,5.25,system you can think of this like the
6729.1,6,Alpine image in Linux the windows server
6732.16,5.91,core though is not as light weight as
6735.1,5.19,you might expect it to be finally
6738.07,5.07,windows containers are supported on
6740.29,5.04,Windows Server 2016 nano server and
6743.14,4.86,windows 10 professional and Enterprise
6745.33,4.91,Edition remember on Windows 10
6748,5.27,professional and Enterprise Edition only
6750.24,5.68,supports hyper-v isolated containers
6753.27,4.9,meaning as we just discussed every
6755.92,5.31,container deployed is deployed on a
6758.17,6.6,highly optimized virtual machine well
6761.23,5.12,that's it about docker on windows now
6764.77,4.79,before I finish I want to
6766.35,5.22,point out one important fact we saw two
6769.56,3.98,ways of running a docker container using
6771.57,4.86,VirtualBox or hyper week but remember
6773.54,5.2,VirtualBox and hyper-v cannot coexist on
6776.43,4.41,the same Windows host so if you started
6778.74,4.44,off with docker toolbox with VirtualBox
6780.84,4.41,and if you plan to migrate to hyper-v
6783.18,3.78,remember you cannot have both solutions
6785.25,3.42,at the same time there is a migration
6786.96,3.96,and guide available on docker
6788.67,5.37,documentation page on how to migrate
6790.92,3.69,from Marshall box to hyper wait that's
6794.04,2.31,it for now
6794.61,13.7,thank you and I will see you the next
6796.35,15.06,lecture we now look at docker on Mac
6808.31,5.29,Locker on Mac is similar to docker on
6811.41,2.73,Windows there are two options to get
6813.6,3.03,started
6814.14,6.06,docker on Mac using docker toolbox or
6816.63,6.81,docker Desktop for Mac option let's look
6820.2,5.55,at the first option docker toolbox this
6823.44,5.61,was the original support for docker on
6825.75,6.45,Mac it is docker on a Linux VM created
6829.05,4.5,using VirtualBox on Mac as with Windows
6832.2,3.72,it has nothing to do with Mac
6833.55,4.62,applications or Mac based images or Mac
6835.92,5.64,containers it purely runs Linux
6838.17,5.55,containers on a Mac OS dog or toolbox
6841.56,4.2,contains a set of tools like Oracle
6843.72,4.02,VirtualBox docker and Jain docker
6845.76,4.2,machine docker compose and a user
6847.74,4.26,interface called CAD Matic when you
6849.96,4.86,download and install the docker toolbox
6852,5.07,executable it installs VirtualBox
6854.82,3.81,deploys lightweight VM called boot a
6857.07,2.07,docker which has dr running in it
6858.63,6.51,already
6859.14,8.13,this requires mac OS 10.8 or newer the
6865.14,5.07,second option is the newer option called
6867.27,5.16,docker Desktop for Mac with docker
6870.21,4.47,Desktop for Mac we take out or
6872.43,4.92,commercial box and use hyper cat
6874.68,4.95,virtualization technology during the
6877.35,4.77,installation process for docker for Mac
6879.63,5.1,it will still automatically create a
6882.12,4.59,Linux system underneath but this time it
6884.73,4.35,is created on hyper kit instead of
6886.71,3.77,Oracle VirtualBox and have dr. running
6889.08,5.91,on that system
6890.48,7.15,this requires Mac OS Sierra 10 or 12 or
6894.99,5.29,newer and Martin and the Mac hardware
6897.63,5.65,must be 2010 or newer model
6900.28,6.09,finally remember that all of this is to
6903.28,5.19,be able to run Linux container on Mac as
6906.37,5.52,of this recording there are no Mac based
6908.47,15.54,images or containers well that's it with
6911.89,14.73,docker on Mac for now we will now try to
6924.01,6.09,understand what container orchestration
6926.62,5.64,is so far in this course we've seen that
6930.1,4.17,with docker you can run a single
6932.26,4.77,instance of the application with a
6934.27,5.46,simple docker run command in this case
6937.03,5.07,to run a node.js based application
6939.73,4.89,you're on the docker run nodejs command
6942.1,5.1,but that's just one instance of your
6944.62,4.35,application on one docker host what
6947.2,4.71,happens when the number of users
6948.97,5.16,increase and that instance is no longer
6951.91,4.35,able to handle the load you deploy
6954.13,3.84,additional instance of your application
6956.26,4.08,by running the docker run command
6957.97,4.68,multiple times so that's something you
6960.34,4.11,have to do yourself you have to keep a
6962.65,3.06,close watch on the load and performance
6964.45,4.2,of your application and deploy
6965.71,4.71,additional instances yourself and not
6968.65,4.83,just that you have to keep a close watch
6970.42,5.76,on the health of these applications and
6973.48,4.62,if a container was to fail you should be
6976.18,3.99,able to detect that and run the docker
6978.1,4.83,run commander game to deploy another
6980.17,4.74,instance of that application what about
6982.93,4.47,the health of the docker host itself
6984.91,5.49,what if the host crashes and is
6987.4,6.39,inaccessible the containers hosted on
6990.4,5.52,that host become inaccessible too so
6993.79,4.49,what do you do in order to solve these
6995.92,5.13,issues you will need a dedicated
6998.28,5.2,engineer who can sit and monitor the
7001.05,4.59,state performance and health of the
7003.48,4.26,containers and take necessary actions to
7005.64,3.96,remediate the situation but when you
7007.74,4.11,have large applications deployed with
7009.6,5.43,tens of thousands of containers that's
7011.85,6.09,that's not a practical approach so you
7015.03,5.61,can build your own scripts and and that
7017.94,6.27,will help you tackle these issues to
7020.64,5.97,some extent container orchestration is
7024.21,5.19,just a solution for that it is a
7026.61,4.92,solution that consists of a set of tools
7029.4,4.27,and scripts that can help host
7031.53,4.149,containers in a production
7033.67,4.38,environment typically a container
7035.679,4.411,orchestration solution consists of
7038.05,5.189,multiple docker host that can host
7040.09,4.95,containers that way even if one fails
7043.239,4.291,the application is still accessible
7045.04,5.159,through the others the container
7047.53,5.01,orchestration solution easily allows you
7050.199,4.741,to deploy hundreds or thousands of
7052.54,5.52,instances of your application with a
7054.94,5.549,single command this is a command used
7058.06,4.23,for docker swarm we will look at the
7060.489,3.811,command itself in a bit
7062.29,4.74,some orchestration solutions can help
