start,dur,text
2758.96,5.43,as installing dependencies where to copy
2761.54,5.18,the source code from and to and what the
2764.39,5.1,entry point of the application is etc
2766.72,4.81,once done build your image
2769.49,5.16,using the docker build command and
2771.53,6.3,specify the docker file as input as well
2774.65,5.63,as a tag named for the image this will
2777.83,4.86,create an image locally on your system
2780.28,5.86,to make it available on the public
2782.69,6.45,docker hub registry run the docker push
2786.14,7.05,command and specify the name of the
2789.14,6.99,image you just created in this case the
2793.19,6.78,name of the image is my account name
2796.13,8.37,which is M Amjad followed by the image
2799.97,6.57,name which is my custom app now let's
2804.5,5.04,take a closer look at that docker file
2806.54,4.86,docker file is a text file written in a
2809.54,4.41,specific format that docker can
2811.4,6.12,understand it's in an instruction and
2813.95,6.24,arguments format for example in this
2817.52,6.36,docker file everything on the left in
2820.19,7.02,caps is an instruction in this case from
2823.88,6.39,run copy and entry point are all
2827.21,5.22,instructions each of these instruct
2830.27,5.31,docker to perform a specific action
2832.43,5.28,while creating the image everything on
2835.58,6.03,the right is an argument to those
2837.71,6.93,instructions the first line from Ubuntu
2841.61,6.24,defines what the base OS should be for
2844.64,6.15,this container every docker image must
2847.85,5.58,be based off of another image either an
2850.79,5.46,OS or another image that was created
2853.43,4.95,before based on an OS you can find
2856.25,5.01,official releases of all operating
2858.38,5.64,systems on docker hub it's important to
2861.26,5.34,note that all docker files must start
2864.02,5.25,with a from instruction the run
2866.6,5.46,instruction instructs docker to run a
2869.27,6.15,particular command on those base images
2872.06,5.91,so at this point docker runs the apt-get
2875.42,4.95,update commands to fetch the updated
2877.97,5.7,packages and installs required
2880.37,5.64,dependencies on the image then the copy
2883.67,5.07,instruction copies files from the local
2886.01,4.71,system onto the docker image in this
2888.74,4.23,case the source code of our application
2890.72,4.89,is in the current folder and I will be
2892.97,5.27,copying it over to the location opt
2895.61,6.06,source code inside the docker image and
2898.24,4.69,finally entry point allows us to specify
2901.67,3.78,a command
2902.93,7.05,that will be run when the image is run
2905.45,6.54,as a container when docker builds the
2909.98,4.799,images it builds these in a layered
2911.99,5.309,architecture each line of instruction
2914.779,4.381,creates a new layer in the docker image
2917.299,5.191,with just the changes from the previous
2919.16,7.8,layer for example the first layer is a
2922.49,6.66,base Ubuntu OS followed by the second
2926.96,4.829,instruction that creates a second layer
2929.15,4.62,which installs all the apt packages and
2931.789,3.78,then the third instruction creates a
2933.77,4.38,third layer with the Python packages
2935.569,4.891,followed by the fourth layer that copies
2938.15,4.379,the source code over and the final layer
2940.46,5.339,that updates the entry point of the
2942.529,5.55,image since each layer only stores the
2945.799,4.98,changes from the previous layer it is
2948.079,5.371,reflected in the size as well if you
2950.779,6.75,look at the base opened to image it is
2953.45,7.02,around 120 MB in size the apt packages
2957.529,5.611,that I install is around 300 MB and the
2960.47,4.53,remaining layers are small you could see
2963.14,4.439,this information if you run the docker
2965,9.52,history command followed by the image
2967.579,8.771,name when you run the
2974.52,3.81,Bilka man you could see the various
2976.35,5.19,steps involved and the result of each
2978.33,5.19,task all the layers built are cast
2981.54,4.2,so the layered architecture helps you
2983.52,5.04,restart docker built from that
2985.74,4.77,particular step in case it fails or if
2988.56,4.23,you were to add new steps in the build
2990.51,9.33,process you wouldn't have to start all
2992.79,10.02,over again all the layers built are
2999.84,5.94,cached by docker so in case a particular
3002.81,6.09,step was to fail for example in this
3005.78,6.089,case step three failed and you were to
3008.9,5.58,fix the issue and rerun docker bill it
3011.869,4.891,will reuse the previous layers from
3014.48,5.46,cache and continue to build the
3016.76,5.43,remaining layers the same is true if you
3019.94,5.34,were to add additional steps in the
3022.19,6.21,docker file this way rebuilding your
3025.28,5.4,image is faster and you don't have to
3028.4,5.43,wait for docker to rebuild the entire
3030.68,5.07,image each time this is helpful
3033.83,4.17,especially when you update source code
3035.75,5.25,of your application as it may change
3038,7.31,more frequently only the layers above
3041,4.31,the updated layers needs to be rebuilt
3047.71,6.12,we just saw a number of products
3050.6,6.45,containerized such as databases
3053.83,6.01,development tools operating systems etc
3057.05,4.77,but that's just not it you can
3059.84,4.14,containerized almost all of the
3061.82,4.94,application even simple ones like
3063.98,6.18,browsers or utilities like curl
3066.76,5.62,applications like Spotify Skype etc
3070.16,5.34,basically you can containerize
3072.38,4.86,everything and going forward and see
3075.5,4.859,that's how everyone is going to run
3077.24,4.379,applications nobody is going to install
3080.359,3.871,anything anymore
3081.619,6.061,going forward instead they're just going
3084.23,4.47,to run it using docker and when they
3087.68,3.6,don't need it anymore
3088.7,4.33,get rid of it easily without having to
3091.28,9.24,clean up too much
3093.03,11.4,[Music]
3100.52,6.51,in this lecture we will look at commands
3104.43,5.939,arguments and entry points in docker
3107.03,5.2,let's start with a simple scenario say
3110.369,4.47,you were to run a docker container from
3112.23,5.43,an Ubuntu image when you run the docker
3114.839,6.301,run open to command it runs an instance
3117.66,5.28,of Ubuntu image and exits immediately if
3121.14,3.93,you were to list the running containers
3122.94,4.56,you wouldn't see the container running
3125.07,5.13,if you list all containers including
3127.5,3.63,those that are stopped you will see that
3130.2,4.71,the new container
3131.13,7.709,you ran is in an exited state now why is
3134.91,6.179,that unlike virtual machines containers
3138.839,4.681,are not meant to host an operating
3141.089,6,system containers are meant to run a
3143.52,5.43,specific task or process such as to host
3147.089,4.321,an instance of a web server or
3148.95,4.32,application server or a database or
3151.41,5.669,simply to carry out some kind of
3153.27,6.93,computation or analysis once the task is
3157.079,6.24,complete the container exits a container
3160.2,6.84,only lives as long as the process inside
3163.319,6.54,it is alive if the web service inside
3167.04,5.52,the container is docked or crashes the
3169.859,5.581,container exits so who defines what
3172.56,5.009,process is run within the container if
3175.44,5.07,you look at the docker file for popular
3177.569,5.671,docker images like ng INX you will see
3180.51,5.13,an instruction called CMD which stands
3183.24,4.14,for command that defines the program
3185.64,5.1,that will be run within the container
3187.38,5.91,when it starts for the ng INX image it
3190.74,6.599,is the ng INX command for the MySQL
3193.29,6.27,image it is the MySQL d command what we
3197.339,4.711,tried to do earlier was to run a
3199.56,5.64,container with a plain Ubuntu operating
3202.05,6.24,system let us look at the docker file
3205.2,7.409,for this image you will see that it uses
3208.29,6.84,bash as the default command now bash is
3212.609,5.73,not really a process like a web server
3215.13,6.18,or database server it is a shell that
3218.339,6.451,listens for inputs from a terminal if it
3221.31,6,cannot find a terminal it exits when we
3224.79,4.77,ran the ubuntu container earlier
3227.31,5.76,created a container from the Ubuntu
3229.56,5.82,image and launched the bash program by
3233.07,4.71,default docker does not attach a
3235.38,5.61,terminal to a container when it is run
3237.78,6.99,and so the bash program does not find
3240.99,5.46,the terminal and so it exits since the
3244.77,4.32,process that was started when the
3246.45,6.09,container was created finished the
3249.09,6.24,container exits as well so how do you
3252.54,5.94,specify a different command to start the
3255.33,5.22,container one option is to append a
3258.48,4.8,command to the docker run command and
3260.55,5.13,that way it overrides the default
3263.28,5.67,command specified within the image in
3265.68,5.76,this case I run the docker run Ubuntu
3268.95,5.94,command with the sleep 5 command as the
3271.44,6.48,added option this way when the container
3274.89,6.27,starts it runs the sleep program waits
3277.92,6.06,for 5 seconds and then exits but how do
3281.16,5.04,you make that change permanent say you
3283.98,4.86,want the image to always run the sleep
3286.2,4.86,command when it starts you would then
3288.84,5.36,create your own image from the base
3291.06,5.43,ubuntu image and specify a new command
3294.2,5.29,there are different ways of specifying
3296.49,6.36,the command either the command simply as
3299.49,6.63,is in a shell form or in a JSON array
3302.85,6.57,format like this but remember when you
3306.12,5.49,specify in a JSON array format the first
3309.42,4.71,element in the array should be the
3311.61,5.73,executable in this case the sleep
3314.13,6.33,program do not specify the command and
3317.34,5.58,parameters together like this the
3320.46,5.61,command and its parameters should be
3322.92,5.52,separate elements in the list so I now
3326.07,5.46,build my new image using the docker
3328.44,5.97,build command and name it as Ubuntu
3331.53,5.97,sleeper I could now simply run the
3334.41,6.84,docker ubuntu sleeper command and get
3337.5,7.23,the same results it always sleeps for 5
3341.25,5.81,seconds and exits but what if I wish to
3344.73,4.74,change the number of seconds it sleeps
3347.06,5.83,currently it is hard-coded
3349.47,6,to 5 seconds as we learned before one
3352.89,4.92,option is to run the docker run command
3355.47,4.97,with the new command appended to it in
3357.81,4.039,this case sleep 10
3360.44,4.71,so the command that will be run at
3361.849,5.641,startup will be sleep 10 but it doesn't
3365.15,5.16,look very good the name of the image
3367.49,5.01,ubuntu sleeper in itself implies that
3370.31,4.44,the container will sleep so we shouldn't
3372.5,4.68,have to specify the sleep command again
3374.75,6.56,instead we would like it to be something
3377.18,6.899,like this docker run ubuntu sleeper 10
3381.31,4.84,we only want to pass in the number of
3384.079,4.171,seconds the container should sleep and
3386.15,4.86,sleep command should be invoked
3388.25,5.18,automatically and that is where the
3391.01,5.43,entry point instructions comes into play
3393.43,5.169,the entry point instruction is like the
3396.44,4.379,command instruction as in you can
3398.599,4.891,specify the program that will be run
3400.819,5.311,when the container starts and whatever
3403.49,5.609,you specify on the command line in this
3406.13,5.64,case 10 will get appended to the entry
3409.099,6.691,point so the command that will be run
3411.77,6.059,when the container starts is sleep 10 so
3415.79,5.279,that's the difference between the two in
3417.829,5.76,case of the CMD instruction the command
3421.069,5.671,line parameters passed will get replaced
3423.589,5.551,entirely whereas in case of entry point
3426.74,6.03,the command line parameters will get
3429.14,6.12,appended now in the second case what if
3432.77,4.94,I run the ubuntu sleeper image command
3435.26,6.51,without appending the number of seconds
3437.71,6.79,then the command at startup will be just
3441.77,5.339,sleep and you get the error that the
3444.5,4.95,operand is missing so how do you
3447.109,5.401,configure a default value for the
3449.45,5.46,command if one was not specified in the
3452.51,5.04,command line that's where you would use
3454.91,5.34,both entry point as well as the command
3457.55,5.1,instruction in this case the command
3460.25,5.22,instruction will be appended to the
3462.65,5.34,entry point instruction so at startup
3465.47,4.56,the command would be sleep 5 if you
3467.99,4.95,didn't specify any parameters in the
3470.03,4.95,command line if you did then that will
3472.94,4.62,override the command instruction and
3474.98,4.98,remember for this to happen you should
3477.56,5.9,always specify the entry point and
3479.96,6.84,command instructions in a JSON format
3483.46,6.21,finally what if you freely really want
3486.8,7.8,to modify the entry point during runtime
3489.67,8.11,say from sleep to an imaginary sleep 2.0
3494.6,6.06,well in that case you can override it by
3497.78,5.76,using the entry point option in the
3500.66,8.16,docker run command the final command at
3503.54,7.8,startup would then be sleep 2.0 10 well
3508.82,13.88,that's it for this lecture and I will
3511.34,14.67,see you in the next we now look at
3522.7,5.8,networking in docker when you install
3526.01,7.44,docker it creates three networks
3528.5,7.53,automatically bridge no and host bridge
3533.45,4.83,is the default network a container gets
3536.03,4.92,attached to if you would like to
3538.28,4.92,associate the container with any other
3540.95,4.8,network you specify the network
3543.2,6.21,information using the network command
3545.75,7.17,line parameter like this we will now
3549.41,6.78,look at each of these networks the BRIT
3552.92,6.21,network is a private internal network
3556.19,5.52,created by docker on the host all
3559.13,4.98,containers attached to this network by
3561.71,6.12,default and they get an internal IP
3564.11,6.93,address usually in the range 170 2.17
3567.83,6.53,series the containers can access each
3571.04,6.21,other using this internal IP if required
3574.36,6.34,to access any of these containers from
3577.25,6.06,the outside world map the ports of these
3580.7,6.45,containers to ports on the docker host
3583.31,6.45,as we have seen before another way to
3587.15,4.5,access the containers externally is to
3589.76,4.98,associate the container to the hosts
3591.65,5.25,network this takes out any network
3594.74,4.62,isolation between the docker host and
3596.9,5.37,the docker container meaning if you were
3599.36,5.25,"to run a web server on port 5,000 in a"
3602.27,5.34,web app container it is automatically as
3604.61,5.55,accessible on the same port externally
3607.61,5.75,without requiring any port mapping as
3610.16,6.36,the web container uses the hosts network
3613.36,6.43,this would also mean that unlike before
3616.52,5.91,you will now not be able to run multiple
3619.79,5.79,web containers on the same host on the
3622.43,5.169,same port as the ports are now common to
3625.58,6.61,all containers in the hole
3627.599,7.2,network with the non network the
3632.19,5.309,containers are not attached to any
3634.799,5.78,network and doesn't have any access to
3637.499,8.85,the external network or other containers
3640.579,8.98,they run in an isolated Network so we
3646.349,7.351,just saw the default burst network with
3649.559,6.18,the network ID 170 2.72 0.1 so all
3653.7,4.409,containers associated to this default
3655.739,4.83,network will be able to communicate to
3658.109,4.65,each other but what if we wish to
3660.569,5.071,isolate the containers within the docker
3662.759,5.82,host for example the first two web
3665.64,5.429,containers on internal network 172 and
3668.579,6.841,the second two containers on a different
3671.069,7.68,internal network like 182 by default
3675.42,6.359,docker only creates one internal bridge
3678.749,5.911,network we could create our own internal
3681.779,5.22,network using the command docker network
3684.66,4.98,create and specified the driver which is
3686.999,4.29,bridge in this case and the subnet for
3689.64,4.679,that network followed by the custom
3691.289,6.44,isolated network name run the docker
3694.319,6.121,network LS command to list all networks
3697.729,4.81,so how do we see the network settings
3700.44,5.01,and the IP address assigned to an
3702.539,5.76,existing container run the docker
3705.45,4.649,inspect command with the ID or name of
3708.299,5.22,the container and you will find a
3710.099,5.16,section on network settings there you
3713.519,4.26,can see the type of network the
3715.259,7.161,container is attached to is internal IP
3717.779,4.641,address MAC address and other settings
3723.349,5.17,containers can reach each other using
3725.91,5.22,their names for example in this case I
3728.519,5.85,have a webserver and a MySQL database
3731.13,5.639,container running on the same node how
3734.369,5.25,can I get my web server to access the
3736.769,5.191,database on the database container one
3739.619,5.041,thing I could do is to use the internal
3741.96,7.799,IP address signed to the MySQL container
3744.66,7.26,which in this case is 170 2.72 0.3 but
3749.759,4.8,that is not very ideal because it is not
3751.92,6.419,guaranteed that the container will get
3754.559,4.281,the same IP when the system reboots the
3758.339,2.841,right
3758.84,5.67,way to do it is to use the container
3761.18,4.53,name all containers in a docker host can
3764.51,4.02,resolve each other
3765.71,5.97,with the name of the container docker
3768.53,5.85,has a built-in DNS server that helps the
3771.68,3.98,containers to resolve each other using
3774.38,4.29,the container name
3775.66,7.77,note that the built in DNS server always
3778.67,9.05,runs at address 127 dot 0 dot 0 dot 11
3783.43,7.09,so how does docker implement networking
3787.72,5.05,what's the technology behind it like how
3790.52,6.84,are the containers isolated within the
3792.77,7.38,host docker uses network namespaces that
3797.36,5.97,creates a separate name space for each
3800.15,6.95,container it then uses virtual Ethernet
3803.33,6.87,pairs to connect containers together
3807.1,5.8,well that's all we can talk about it for
3810.2,4.8,now more about these or advanced
3812.9,5.84,concepts that we discussed in the
3815,6.63,advanced course on docker on code cloud
3818.74,5.02,that's all for now from this lecture on
3821.63,3.8,networking head over to the practice
3823.76,5.1,tests and practice working with
3825.43,4.77,networking in docker I will see you in
3828.86,9.489,the next lecture
3830.2,10.95,[Music]
3838.349,5.71,hello and welcome to this lecture and we
3841.15,4.5,are learning advanced docker concepts in
3844.059,4.43,this lecture we're going to talk about
3845.65,6,docker storage drivers and file systems
3848.489,5.83,we're going to see where and how docker
3851.65,6.27,stores data and how it manages file
3854.319,6.42,systems of the containers let us start
3857.92,6.419,with how docker stores data on the local
3860.739,6.33,file system when you install docker on a
3864.339,6.96,system it creates this folder structure
3867.069,7.321,at where lib docker you have multiple
3871.299,6.66,folders under it called a ufs containers
3874.39,6.719,image volumes etc this is where docker
3877.959,4.05,stores all its data by default when I
3881.109,3.51,say data
3882.009,4.7,I mean files related to images and
3884.619,5.37,containers running on the docker host
3886.709,5.11,for example all files related to
3889.989,4.29,containers are stored under the
3891.819,4.621,containers folder and the files related
3894.279,5.01,to images are stored under the image
3896.44,4.919,folder any volumes created by the docker
3899.289,4.44,containers are created under the volumes
3901.359,4.791,folder well don't worry about that for
3903.729,5.52,now we will come back to that in a bit
3906.15,6.099,for now let's just understand where
3909.249,7.05,docker stores its files and in what
3912.249,7.08,format so how exactly does docker store
3916.299,4.98,the files of an image and a container to
3919.329,5.341,understand that we need to understand
3921.279,5.401,Dockers layered architecture let's
3924.67,4.859,quickly recap something we learned when
3926.68,5.76,docker builds images it builds these in
3929.529,5.881,a layered architecture each line of
3932.44,5.789,instruction in the docker file creates a
3935.41,5.429,new layer in the docker image with just
3938.229,5.58,the changes from the previous layer for
3940.839,5.67,example the first layer is a base Ubuntu
3943.809,5.01,operating system followed by the second
3946.509,5.401,instruction that creates a second layer
3948.819,5.341,which installs all the apt packages and
3951.91,4.829,then the third instruction creates a
3954.16,4.919,third layer which with the Python
3956.739,4.59,packages followed by the fourth layer
3959.079,4.77,that copies the source code over and
3961.329,6.71,then finally the fifth layer that
3963.849,4.19,updates the entry point of the image
3968.57,5.73,each layer only stores the changes from
3971.93,5.31,the previous layer it is reflected in
3974.3,6.24,the size as well if you look at the base
3977.24,6.69,open to image it is around 120 megabytes
3980.54,6.18,in size the apt packages that I install
3983.93,6.45,is around 300 MB and then the remaining
3986.72,5.96,layers are small to understand the
3990.38,6.57,advantages of this layered architecture
3992.68,6.67,let's consider a second application this
3996.95,4.47,application has a different talker file
3999.35,5.37,but it's very similar to our first
4001.42,6.66,application as in it uses the same base
4004.72,6.66,image as Ubuntu uses the same Python and
4008.08,5.55,flask dependencies but uses a different
4011.38,5.1,source code to create a different
4013.63,5.28,application and so a different entry
4016.48,5.01,point as well when I run the docker
4018.91,5.28,build command to build a new image for
4021.49,5.25,this application since the first three
4024.19,5.61,layers of both the applications are the
4026.74,6.78,same docker is not going to build the
4029.8,6.33,first three layers instead it reuses the
4033.52,5.43,same three layers it built for the first
4036.13,5.55,application from the cache and only
4038.95,6.51,creates the last two layers with the new
4041.68,6.45,sources and the new entry point this way
4045.46,6.27,docker builds images faster and
4048.13,5.88,efficiently saves disk space this is
4051.73,4.89,also applicable if you were to update
4054.01,5.4,your application code whenever you
4056.62,6.06,update your application code such as the
4059.41,5.52,app dot py in this case docker simply
4062.68,4.65,reuses all the previous layers from
4064.93,5.13,cache and quickly rebuilds the
4067.33,6.24,application image by updating the latest
4070.06,8.55,source code thus saving us a lot of time
4073.57,7.74,hearing rebuilds and updates let's
4078.61,5.43,rearrange the layers bottom up so we can
4081.31,5.19,understand it better at the bottom we
4084.04,5.94,have the base ubuntu layer than the
4086.5,5.49,packages then the dependencies and then
4089.98,5.88,the source code of the application and
4091.99,6.75,then the entry point all of these layers
4095.86,6.129,are created when we run the docker build
4098.74,6.249,command to form the final docker image
4101.989,6,so all of these are the darker image
4104.989,4.891,layers once the build is complete you
4107.989,4.651,cannot modify the contents of these
4109.88,5.64,layers and so they are read-only and you
4112.64,6.329,can only modify them by initiating a new
4115.52,5.73,build when you run a container based off
4118.969,5.31,of this image using the docker run
4121.25,5.64,command docker creates a container based
4124.279,5.19,off of these layers and creates a new
4126.89,5.969,writable layer on top of the image layer
4129.469,6.27,the writable layer is used to store data
4132.859,4.86,created by the container such as log
4135.739,4.02,files written by the applications any
4137.719,5.071,temporary files generated by the
4139.759,6.361,container or just any file modified by
4142.79,6.12,the user on that container the life of
4146.12,5.25,this layer though is only as long as the
4148.91,4.92,container is alive when the container is
4151.37,5.449,destroyed this layer and all of the
4153.83,5.759,changes stored in it are also destroyed
4156.819,5.831,remember that the same image layer is
4159.589,7.051,shared by all containers created using
4162.65,6.959,this image if I were to log in to the
4166.64,6.69,newly created container and say create a
4169.609,6.061,new file called temp dot txt it will
4173.33,5.489,create that file in the container layer
4175.67,5.399,which is read and write we just said
4178.819,4.23,that the files in the image layer are
4181.069,5.52,read-only meaning you cannot edit
4183.049,6.181,anything in those layers let's take an
4186.589,5.67,example of our application code since we
4189.23,5.28,bake our code into the image the code is
4192.259,5.821,part of the image layer and as such is
4194.51,5.94,read-only after running a container what
4198.08,5.97,if I wish to modify the source code to
4200.45,5.789,say test a change remember the same
4204.05,4.5,image layer may be shared between
4206.239,5.461,multiple containers created from this
4208.55,6.27,image so does it mean that I cannot
4211.7,6.81,modify this file inside the container no
4214.82,5.97,I can still modify this file but before
4218.51,4.709,I save the modified file docker
4220.79,4.89,automatically creates a copy of the file
4223.219,4.621,in the read/write layer and I will then
4225.68,5.67,be modifying a different version of the
