start,dur,text
1352.09,4.98,sure of the name run the docker PS
1354.07,4.83,command to get it on success you will
1357.07,4.68,see the name printed out and running
1358.9,6.18,docker PS again will show no running
1361.75,5.61,containers running docker PS - a
1365.08,5.4,however shows the container silly summit
1367.36,6.9,and that it is in an accident states a
1370.48,5.52,few seconds ago now what if we don't
1374.26,3.99,want this container lying around
1376,5.58,consuming space what if we want to get
1378.25,5.91,rid of it for good use the docker RM
1381.58,5.64,command to remove a stopped or exited
1384.16,5.43,container permanently if it prints the
1387.22,4.83,name back we're good run the docker PS
1389.59,5.49,command again to verify that it's no
1392.05,5.88,longer present good but what about the
1395.08,5.31,nginx image that was downloaded at first
1397.93,5.97,we're not using that anymore so how do
1400.39,6.03,we get rid of that image but first how
1403.9,5.16,do we see a list of images present on
1406.42,4.98,our hosts run the docker images command
1409.06,4.98,to see a list of available images and
1411.4,6,their sizes on our hosts we have four
1414.04,6.15,images the nginx Redis Ubuntu and Alpine
1417.4,6.39,we will talk about tags later in this
1420.19,5.91,course when we discuss about images to
1423.79,5.51,remove an image that you no longer plan
1426.1,5.94,to use run the docker RM I command
1429.3,4.93,remember you must ensure that no
1432.04,4.08,containers are running off of that image
1434.23,4.71,before attempting to remove the image
1436.12,5.48,you must stop and delete all dependent
1438.94,5.61,containers to be able to delete an image
1441.6,5.86,when we ran the docker run command
1444.55,6.09,earlier it downloaded the Ubuntu image
1447.46,5.52,as it couldn't find one locally what if
1450.64,5.43,we simply want to download the image and
1452.98,5.46,keep so when we run the run docker run
1456.07,5.79,command we don't want to wait for it to
1458.44,5.85,download use the docker pull command to
1461.86,4.2,only pull the image and not run the
1464.29,4.68,container so in this case the docker
1466.06,6.33,pull a bull to come and pulls the Ubuntu
1468.97,5.73,image and stores it on our host let's
1472.39,4.32,look at another example say you were to
1474.7,4.89,run a docker container from an Ubuntu
1476.71,5.37,image when you run the docker run Ubuntu
1479.59,5.58,command it runs an instance of Ubuntu
1482.08,4.92,image and exits immediately if you were
1485.17,3.57,to list the Irani containers you
1487,3.63,wouldn't see the container running if
1488.74,4.02,you list all containers including those
1490.63,5.07,that are stopped you will see that the
1492.76,5.46,new container iran is in an exited state
1495.7,5.55,now why is that
1498.22,5.6,unlike virtual machines containers are
1501.25,5.85,not meant to host an operating system
1503.82,6.01,containers are meant to run a specific
1507.1,4.35,task or process such as to host an
1509.83,4.589,instance of a web server or application
1511.45,5.76,server or a database or simply to carry
1514.419,6.12,some kind of computation or analysis
1517.21,7.02,tasks once the task is complete the
1520.539,6.181,container exits a container only lives
1524.23,4.919,as long as the process inside it is
1526.72,5.28,alive if the web service inside the
1529.149,5.971,container is stopped or crash then the
1532,5.309,container exits this is why when you run
1535.12,5.009,a container from an Ubuntu image it
1537.309,4.86,stops immediately because a bundu is
1540.129,4.861,just an image of an operating system
1542.169,5.281,that is used as the base image for other
1544.99,5.429,applications there is no process or
1547.45,5.88,application running in it by default if
1550.419,5.401,the image isn't running any service and
1553.33,5.579,as is the case with Ubuntu you could
1555.82,5.4,instruct docker to run a process with
1558.909,4.681,the docker run command for example a
1561.22,5.189,sleep command with a duration of 5
1563.59,5.01,seconds when the container starts it
1566.409,5.61,runs the sleep command and goes into
1568.6,5.959,sleep for 5 seconds post which the sleep
1572.019,5.551,command exits and the container stops
1574.559,5.74,what we just saw was executing a command
1577.57,4.41,when we run the container but what if we
1580.299,4.62,would like to execute a command on a
1581.98,4.89,running container for example when I run
1584.919,4.59,the docker PS command I can see that
1586.87,5.659,there is a running container which uses
1589.509,5.55,the Ubuntu image and sleeps 400 seconds
1592.529,4.571,let's say I would like to see the
1595.059,4.47,contents of a file inside this
1597.1,5.34,particular container I could use the
1599.529,5.671,docker exec command to execute a command
1602.44,6.329,on my docker container in this case to
1605.2,6.929,print the contents of the Etsy hosts
1608.769,5.071,file finally let's look at one more
1612.129,4.68,option before we head over to the
1613.84,5.4,practice exercises I'm now going to run
1616.809,5.22,a docker image I developed for a simple
1619.24,6.689,web application the repository name is
1622.029,5.88,code cloud slash simple web app it runs
1625.929,5.61,a simple web server that listens on port
1627.909,6.541,8080 when you run a docker run
1631.539,5.76,like this it runs in the foreground or
1634.45,5.669,in an attached mode meaning you will be
1637.299,5.161,attached to the console or the standard
1640.119,4.29,out of the docker container and you will
1642.46,4.649,see the output of the web service on
1644.409,4.681,your screen you won't be able to do
1647.109,3.66,anything else on this console other than
1649.09,4.649,view the output until this docker
1650.769,7.71,container stops it won't respond to your
1653.739,6.961,inputs press the ctrl + C combination to
1658.479,5.101,stop the container and the application
1660.7,6.599,hosted on the container exits and you
1663.58,6.39,get back to your prompt another option
1667.299,5.72,is to run the docker container in the D
1669.97,6.209,test mode by providing the dash D option
1673.019,5.26,this will run the docker container in
1676.179,4.92,the background mode and you will be back
1678.279,5.911,to your prompt immediately the container
1681.099,4.231,will continue to run in the backend run
1684.19,4.77,the docker PS command
1685.33,5.549,to view the running container now if you
1688.96,5.309,would like to attach back to the running
1690.879,5.91,container later run the docker attach
1694.269,5.73,command and specify the name or ID of
1696.789,5.401,the docker container now remember if you
1699.999,4.89,are specifying the ID of a container in
1702.19,4.919,any docker command you can simply
1704.889,4.71,provide the first few characters alone
1707.109,5.341,just so it is different from the other
1709.599,8.4,container IDs on the host in this case I
1712.45,7.74,specified a 0 for 3 D now don't worry
1717.999,4.711,about accessing the UI of the webserver
1720.19,4.979,for now we will look more into that in
1722.71,5.13,the upcoming lectures for now let's just
1725.169,5.041,understand the basic commands will not
1727.84,4.769,get our hands dirty with the docker CLI
1730.21,4.75,so let's take a look at how to access
1732.609,7.061,the practice lab environments next
1734.96,7.9,[Music]
1739.67,6.67,let me now walk you through the hands-on
1742.86,5.73,lab practice environment the links to
1746.34,4.92,access the labs associated with this
1748.59,6.24,course are available at cold cloud at
1751.26,6.57,code cloud comm slash P slash docker
1754.83,4.35,dash labs this link is also given in the
1757.83,3.57,description of this video
1759.18,4.38,once you're on this page use the links
1761.4,5.79,given there to access the labs
1763.56,6.87,associated to your lecture each lecture
1767.19,5.34,has its own lab so remember to choose
1770.43,5.13,the right lab for your lecture
1772.53,5.55,the labs open up right in your browser I
1775.56,5.25,would recommend to use google chrome
1778.08,4.8,while working with the labs the
1780.81,4.5,interface consists of two parts a
1782.88,4.89,terminal on the left and a quiz portal
1785.31,4.23,on the right the cooze portal on the
1787.77,3.9,right gives you challenges to solve
1789.54,4.29,follow the quiz and try and answer the
1791.67,4.98,questions asked and complete the tasks
1793.83,5.19,given to you each scenario consists of
1796.65,4.35,anywhere from 10 to 20 questions that
1799.02,4.92,needs to be answered within 30 minutes
1801,4.95,to an hour at the top you have the
1803.94,4.2,question numbers below that is the
1805.95,3.06,remaining time for your lab below that
1808.14,2.73,is the question
1809.01,4.2,if you're not able to solve the
1810.87,4.53,challenge look for hints in the hints
1813.21,4.08,section you may skip a question by
1815.4,4.56,hitting the skip button in the top right
1817.29,5.19,corner but remember that you will not be
1819.96,5.43,able to go back to a previous question
1822.48,5.43,once you have skipped if the quiz portal
1825.39,5.73,gets stuck for some reason click on the
1827.91,9.84,quiz portal tab at the top to open the
1831.12,7.439,quiz portal in a separate window the
1837.75,2.85,terminal
1838.559,4.5,gives you access to a real system
1840.6,4.47,running docker you can run any docker
1843.059,4.5,command here and run your own containers
1845.07,4.29,or applications you would typically be
1847.559,4.771,running commands to solve the tasks
1849.36,4.26,assigned in the quiz portal you may play
1852.33,3.419,around and experiment with this
1853.62,4.23,environment but make sure you do that
1855.749,4.231,after you've gone through the quiz so
1857.85,5.789,that your work does not interfere with
1859.98,6.24,the tasks provided by the quiz so let me
1863.639,4.981,walk you through a few questions there
1866.22,4.14,are two types of questions each lab
1868.62,4.259,scenario starts with a set of
1870.36,4.86,exploratory multiple-choice questions
1872.879,4.26,where you're asked to explore and find
1875.22,5.22,information in the given environment and
1877.139,5.461,select the right answer this is to get
1880.44,4.26,you familiarized with a set up you are
1882.6,5.1,then asked to perform tasks like run a
1884.7,6.75,container stop them delete them build
1887.7,5.76,your own image etc here the first
1891.45,4.16,question asks us to find the version of
1893.46,4.86,docker server engine running on the host
1895.61,4.98,run the docker reversion command in the
1898.32,4.77,terminal and identify the right version
1900.59,6.909,then select the appropriate option from
1903.09,7.169,the given choices another example is the
1907.499,6.66,fourth question where it asks you to run
1910.259,6.181,a container using the Redis image if
1914.159,5.64,you're not sure of the command click on
1916.44,5.4,hints and it will show you a hint we now
1919.799,4.171,run in Redis container using the docker
1921.84,4.679,run readies command wait for the
1923.97,5.699,container to run once done click on
1926.519,4.951,check to check your work we have now
1929.669,4.14,successfully completed the task
1931.47,5.209,similarly follow along and complete all
1933.809,5.19,tasks once the lab exercise is completed
1936.679,4.38,remember to leave a feedback and let us
1938.999,5.28,know how it went a few things to note
1941.059,5.59,these are publicly accessible labs that
1944.279,5.15,anyone can access so if you catch
1946.649,6.081,yourself logged out during a peak hour
1949.429,6.58,please wait for some time and try again
1952.73,5.789,also remember to not store any private
1956.009,5.67,or confidential data on these systems
1958.519,5.5,remember that this environment is for
1961.679,4.771,learning purposes only and is only alive
1964.019,6.27,for an hour after which the lab is
1966.45,4.24,destroyed so does all your work but you
1970.289,3.071,missed
1970.69,5.64,/ and access these labs as many times as
1973.36,5.25,you want until you feel confident I will
1976.33,4.86,also post solutions to these lab quizzes
1978.61,5.46,so if you run into issues you may refer
1981.19,4.98,to those that's it for now head over to
1984.07,13.05,the first challenge and I will see you
1986.17,14.1,on the other side we will now look at
1997.12,4.56,some of the other docker run commands at
2000.27,2.97,the end of this lecture you will go
2001.68,4.29,through a hands-on quiz where you will
2003.24,5.79,practice working with these commands we
2005.97,4.95,learned that we could use the docker run
2009.03,4.41,Redis command to run the container
2010.92,4.8,running a Redis service in this case the
2013.44,6.36,latest version of Redis which happens to
2015.72,6.12,be 5.0 to 5 as of today but what if we
2019.8,4.65,want to run another version of Redis
2021.84,6,like for example and older versions say
2024.45,6.96,4.0 then you specify the version
2027.84,7.83,separated by a colon this is called a
2031.41,7.08,tag in that case docker pulls an image
2035.67,6.75,of the 4.0 version of Redis and runs
2038.49,6.6,that also notice that if you don't
2042.42,5.49,specify any tag as in the first command
2045.09,7.05,docker will consider the default tag to
2047.91,6.02,be latest latest is a tag associated to
2052.14,4.5,the latest version of that software
2053.93,6.73,which is governed by the authors of that
2056.64,6.33,software so as a user how do you find
2060.66,6.33,information about these versions and
2062.97,6.99,what is the latest at docker hub com
2066.99,5.33,look up an image and you will find all
2069.96,4.89,the supported tags in its description
2072.32,5.2,each version of the software can have
2074.85,7.17,multiple short and long tags associated
2077.52,7.5,with it as seen here in this case the
2082.02,5.27,version fight of 0.5 also has the latest
2085.02,6.45,tag on it
2087.29,7.06,let's now look at inputs I have a simple
2091.47,5.61,prompt application that when run asks
2094.35,6.29,for my name and on entering my name
2097.08,5.989,prints a welcome message if I were to
2100.64,5.399,this application and run it as a docker
2103.069,5.611,container like this it wouldn't wait for
2106.039,4.441,the prompt it just prints whatever the
2108.68,5.46,application is supposed to print on
2110.48,6.69,standard out that is because by default
2114.14,5.58,the docker container does not listen to
2117.17,5.25,a standard input even though you are
2119.72,5.549,attached to its console it is not able
2122.42,5.46,to read any input from you it doesn't
2125.269,6.391,have a terminal to read inputs from it
2127.88,5.37,runs in an own interactive mode if you'd
2131.66,4.74,like to provide your input
2133.25,5.789,you must map the standard input of your
2136.4,5.369,host to the docker container using the -
2139.039,5.371,I parameter the - I parameter is for
2141.769,6.51,interactive mode and when I input my
2144.41,5.369,name it prints the expected output but
2148.279,6.81,there is something still missing from
2149.779,8.941,this the prompt when we run the app at
2155.089,6.361,first it asked us for our name but when
2158.72,4.71,docker iced that prompt is missing even
2161.45,5.159,though it seems to have accepted my
2163.43,6.089,input that is because the application
2166.609,6.631,prompt on the terminal and we have not
2169.519,7.381,attached to the containers terminal for
2173.24,8.22,this use the - T option as well the - T
2176.9,7.74,stands for a sudo terminal so with the
2181.46,5.22,combination of - int we are now attached
2184.64,5.219,to the terminal as well as in an
2186.68,5.579,interactive mode on the container we
2189.859,5.16,will now look at port mapping or port
2192.259,4.921,publishing on containers let's go back
2195.019,4.35,to the example where we run a simple web
2197.18,4.859,application in a docker container on my
2199.369,5.19,daugher host remember the underlying
2202.039,5.82,host where docker is installed is called
2204.559,5.641,docker host or docker engine when we run
2207.859,4.5,a containerized web application it runs
2210.2,5.28,and we are able to see that the server
2212.359,5.94,is running but how does a user access my
2215.48,6.539,application as you can see my
2218.299,5.611,application is listening on port 5000 so
2222.019,6.481,I could access my application by using
2223.91,7.29,port 5000 but what IP do I use to access
2228.5,5.789,it from a web browser there are two
2231.2,5.069,options available one is to use the IP
2234.289,4.38,the docker container every docker
2236.269,7.17,container gets an IP assigned by default
2238.669,7.56,in this case it is 172 dot 17.0 2 but
2243.439,4.92,remember that this is an internal IP and
2246.229,4.921,is only accessible within the docker
2248.359,5.18,host so if you open a browser from
2251.15,6.199,within the docker host you can go to
2253.539,9.4,http colon forward slash forward slash
2257.349,9.281,"172 dot 17 dot 0 dot 1 colon 5,000 to"
2262.939,6.78,access the IP address but since this is
2266.63,5.039,an internal IP users outside of the
2269.719,5.7,docker host cannot access it using this
2271.669,5.85,IP for this we could use the IP of the
2275.419,5.491,docker host which is one ninety two dot
2277.519,6.21,one sixty eight dot 1.5 but for that to
2280.91,5.309,work you must have mapped the port
2283.729,5.94,inside the docker container to a free
2286.219,5.49,port on the docker host for example if I
2289.669,4.32,want the users to access my application
2291.709,6.12,through port 80 on my docker host I
2293.989,6.78,could map port 80 of localhost to port
2297.829,6.15,5000 on the docker container using the
2300.769,7.41,dash P parameter in my run command like
2303.979,7.161,this and so the user can access my
2308.179,6,application by going to the URL HTTP
2311.14,5.949,colon slash slash one ninety two dot one
2314.179,7.05,sixty eight dot one dot five colon 80
2317.089,7.71,and all traffic on port 80 on my daugher
2321.229,7.32,host will get routed to port 5000 inside
2324.799,5.581,the docker container this way you can
2328.549,3.93,run multiple instances of your
2330.38,4.889,application and map them to different
2332.479,5.04,ports on the docker host or run
2335.269,4.71,instances of different applications on
2337.519,5.25,different ports for example in this case
2339.979,5.25,and running an instance of MySQL that
2342.769,5.25,runs a database on my host and listens
2345.229,5.97,on the default MySQL port which happens
2348.019,7.621,to be three 3:06 or another instance of
2351.199,6.451,MySQL on another port eight 3:06 so you
2355.64,4.619,can run as many applications like this
2357.65,5.49,and map them to as many ports as you
2360.259,4.77,want and of course you cannot map to the
2363.14,4.919,same port on the docker host more than
2365.029,4.77,once we will
2368.059,3.15,because more about port mapping and
2369.799,4.29,networking of containers in the
2371.209,5.85,networked lecture later on let's now
2374.089,6.15,look at how data is persisted in a
2377.059,5.88,docker container for example let's say
2380.239,5.04,you were to run a MySQL container when
2382.939,5.701,databases and tables are created the
2385.279,6.651,data files are stored in location /wor
2388.64,5.879,Labe MySQL inside the docker container
2391.93,5.529,remember the docker container has its
2394.519,6.23,own isolated filesystem and any changes
2397.459,6.51,to any files happen within the container
2400.749,5.891,let's assume you dump a lot of data into
2403.969,5.22,the database what happens if you were to
2406.64,5.879,delete the MySQL container and remove it
2409.189,5.971,as soon as you do that the container
2412.519,6.18,along with all the data inside it gets
2415.16,6.779,blown away meaning all your data is gone
2418.699,5.58,if you would like to persist data you
2421.939,4.59,would want to map a directory outside
2424.279,4.891,the container on the docker host to a
2426.529,5.851,directory inside the container in this
2429.17,8.49,case I create a directory called /opt
2432.38,8.609,slash data dir and map that to var Lib
2437.66,5.879,MySQL inside the docker container using
2440.989,4.95,the - V option and specifying the
2443.539,4.68,directory on the door host followed by a
2445.939,3.59,colon and the directory inside the
2448.219,4.47,crocker container
2449.529,5.83,this way when docker container runs it
2452.689,5.28,will implicitly mount the external
2455.359,5.61,directory to a folder inside the docker
2457.969,5.84,container this way all your data will
2460.969,6.75,now be stored in the external volume at
2463.809,6.101,/opt slash data directory and thus will
2467.719,6.03,remain even if you delete the docker
2469.91,5.459,container the docker PS command is good
2473.749,4.921,enough to get basic details about
2475.369,4.89,containers like their names and ID's but
2478.67,4.439,if you would like to see additional
2480.259,5.01,details about a specific container use
2483.109,5.521,the docker inspect command and provide
2485.269,5.91,the container name or ID it returns all
2488.63,5.52,details of a container in a JSON format
2491.179,6.42,such as the state Mounds configuration
2494.15,5.309,data network settings etc remember to
2497.599,4.261,use it when you are required to find
2499.459,4.771,details on a container
2501.86,4.65,finally how do we see the logs of a
2504.23,4.02,container we're on in the background for
2506.51,5.13,example I ran my simple web application
2508.25,6.42,using the - D parameter and it ran the
2511.64,5.1,container in a detached mode how do I
2514.67,4.02,view the logs which happens to be the
2516.74,5.25,contents written to the standard out of
2518.69,5.73,that container use the docker logs
2521.99,6.63,command and specify the container ID or
2524.42,6.24,name like this well that's it for this
2528.62,14.64,lecture head over to the challenges and
2530.66,14.25,practice working with docker commands so
2543.26,5.01,to start with a simple web application
2544.91,5.49,written in Python this piece of code is
2548.27,4.11,used to create a web application that
2550.4,4.56,displays a web page with a background
2552.38,5.04,color if you look closely into the
2554.96,4.41,application code you will see a line
2557.42,5.7,that sets the background color to red
2559.37,5.91,now that works just fine however if you
2563.12,3.99,decide to change the color in the future
2565.28,5.28,you will have to change the application
2567.11,5.7,code it is a best practice to move such
2570.56,4.71,information out of the application code
2572.81,6.15,and into say an environment variable
2575.27,5.67,called app color the next time you run
2578.96,4.35,the application set an environment
2580.94,5.1,variable called app color to a desired
2583.31,5.43,value and the application now has a new
2586.04,5.16,color once your application gets
2588.74,4.92,packaged into a docker image you will
2591.2,4.14,then run it with the docker run command
2593.66,4.5,followed by the name of the image
2595.34,5.58,however if you wish to pass the
2598.16,5.55,environment variable as we did before he
2600.92,5.22,would now use the docker run commands -
2603.71,6.09,II option to set an environment variable
2606.14,5.79,within the container to deploy multiple
2609.8,4.26,containers with different colors he
2611.93,4.5,would run the docker command multiple
2614.06,6.06,times and set a different value for the
2616.43,6.33,environment variable each time so how do
2620.12,5.91,you find the environment variable set on
2622.76,6.03,a container that's already running use
2626.03,4.4,the docker inspect command to inspect
2628.79,4.08,the properties of a running container
2630.43,5.26,under the config section you will find
2632.87,5.19,the list of environment variables
2635.69,4.62,on the container well that's it for this
2638.06,3.94,lecture on configuring environment
2640.31,10.61,variables in docker
2642,11.45,[Music]
2650.92,6.07,hello and welcome to this lecture on
2653.45,5.639,docker images in this lecture we're
2656.99,6.03,going to see how to create your own
2659.089,6.51,image now before that why would you need
2663.02,5.309,to create your own image it could either
2665.599,5.041,be because you cannot find a component
2668.329,4.53,or a service that you want to use as
2670.64,4.979,part of your application on docker hub
2672.859,4.381,already or you and your team decided
2675.619,4.95,that the application you're developing
2677.24,6.72,will be derived for ease of shipping and
2680.569,6.811,deployment in this case I'm going to
2683.96,6.09,containerize an application a simple web
2687.38,6.689,application that I have built using the
2690.05,6.33,Python flask framework first we need to
2694.069,4.711,understand what we our container izing
2696.38,4.77,or what application we are creating an
2698.78,5.01,image for and how the application is
2701.15,4.38,built so start by thinking what you
2703.79,4.38,might do if you want to deploy the
2705.53,4.819,application manually we write down the
2708.17,4.83,steps required in the right order I'm
2710.349,5.081,creating an image for a simple web
2713,5.01,application if I were to set it up
2715.43,5.79,manually I would start with an operating
2718.01,5.579,system like Ubuntu then update the
2721.22,5.01,source repositories using the apt
2723.589,5.371,command then install dependencies using
2726.23,5.58,the apt command then install Python
2728.96,4.59,dependencies using the PIP command then
2731.81,4.95,copy over the source code of my
2733.55,6.24,application to a location like opt and
2736.76,5.67,then finally run the web server using
2739.79,5.34,the flask command now that I have the
2742.43,5.13,instructions create a docker file using
2745.13,5.61,this here's a quick overview of the
2747.56,6.18,process of creating your own image first
2750.74,5.19,create a docker file named docker file
2753.74,5.22,and write down the instructions for
2755.93,5.61,setting up your application in it such
